tier1,tier2,hours_per_day,growth_collection,processing,preparation,material,energy,things,buildings,infrastructure,inhabited,waste,sleep,hygiene_grooming,childcare,adultcare,moving_things,moving_people,organization,education_research,meals,active_rec,religious,social,interactive,passive,work_employment,work_other,unknown
Employment and related activities ,Employment and related activities ,3.6,nan;nan,nan;nan,nan;nan,nan;nan,nan;nan,nan;nan,nan;nan,nan;nan,nan;nan,nan;nan,nan;nan,nan;nan,nan;nan,nan;nan,nan;nan,nan;nan,nan;nan,nan;nan,nan;nan,nan;nan,nan;nan,nan;nan,nan;nan,nan;nan,1.0;0.0,nan;nan,nan;nan
Production of goods for own household use ,Production of goods for own household use ,0,nan;nan,nan;nan,nan;nan,nan;nan,nan;nan,1.0;0.0,nan;nan,nan;nan,nan;nan,nan;nan,nan;nan,nan;nan,nan;nan,nan;nan,nan;nan,nan;nan,nan;nan,nan;nan,nan;nan,nan;nan,nan;nan,nan;nan,nan;nan,nan;nan,nan;nan,nan;nan,nan;nan
Food and meals management and preparation,Food and meals management and preparation,1.21,nan;nan,nan;nan,1.0;0.0,nan;nan,nan;nan,nan;nan,nan;nan,nan;nan,nan;nan,nan;nan,nan;nan,nan;nan,nan;nan,nan;nan,nan;nan,nan;nan,nan;nan,nan;nan,nan;nan,nan;nan,nan;nan,nan;nan,nan;nan,nan;nan,nan;nan,nan;nan,nan;nan
Cleaning and maintaining of own dwelling and surroundings ,Cleaning and maintaining of own dwelling and surroundings ,0.622,nan;nan,nan;nan,nan;nan,nan;nan,nan;nan,nan;nan,0.2;0.1,nan;nan,0.8;0.1,nan;nan,nan;nan,nan;nan,nan;nan,nan;nan,nan;nan,nan;nan,nan;nan,nan;nan,nan;nan,nan;nan,nan;nan,nan;nan,nan;nan,nan;nan,nan;nan,nan;nan,nan;nan
"Do-it-yourself decoration, maintenance and repair","Do-it-yourself decoration, maintenance and repair",0.047,nan;nan,nan;nan,nan;nan,nan;nan,nan;nan,0.4;0.1,0.4;0.1,nan;nan,0.2;0.1,nan;nan,nan;nan,nan;nan,nan;nan,nan;nan,nan;nan,nan;nan,nan;nan,nan;nan,nan;nan,nan;nan,nan;nan,nan;nan,nan;nan,nan;nan,nan;nan,nan;nan,nan;nan
Care and maintenance of textiles and footwear,Care and maintenance of textiles and footwear,0.265,nan;nan,nan;nan,nan;nan,nan;nan,nan;nan,nan;nan,nan;nan,nan;nan,1.0;0.0,nan;nan,nan;nan,nan;nan,nan;nan,nan;nan,nan;nan,nan;nan,nan;nan,nan;nan,nan;nan,nan;nan,nan;nan,nan;nan,nan;nan,nan;nan,nan;nan,nan;nan,nan;nan
"Shopping, pet care, payment of bills, etc","Shopping, pet care, payment of bills, etc",0.282,nan;nan,nan;nan,nan;nan,nan;nan,nan;nan,nan;nan,nan;nan,nan;nan,0.1;0.05,nan;nan,nan;nan,nan;nan,nan;nan,nan;nan,nan;nan,nan;nan,0.9;0.05,nan;nan,nan;nan,nan;nan,nan;nan,nan;nan,nan;nan,nan;nan,nan;nan,nan;nan,nan;nan
Childcare and teaching of children,Childcare and teaching of children,0.325,nan;nan,nan;nan,nan;nan,nan;nan,nan;nan,nan;nan,nan;nan,nan;nan,nan;nan,nan;nan,nan;nan,nan;nan,0.85;0.075,nan;nan,nan;nan,nan;nan,nan;nan,0.15;0.075,nan;nan,nan;nan,nan;nan,nan;nan,nan;nan,nan;nan,nan;nan,nan;nan,nan;nan
Care of adults (sick or elderly),Care of adults (sick or elderly),0.047,nan;nan,nan;nan,nan;nan,nan;nan,nan;nan,nan;nan,nan;nan,nan;nan,nan;nan,nan;nan,nan;nan,nan;nan,nan;nan,1.0;0.0,nan;nan,nan;nan,nan;nan,nan;nan,nan;nan,nan;nan,nan;nan,nan;nan,nan;nan,nan;nan,nan;nan,nan;nan,nan;nan
Travel related to above SNA activities,Travel related to above SNA activities,0.312,nan;nan,nan;nan,nan;nan,nan;nan,nan;nan,nan;nan,nan;nan,nan;nan,nan;nan,nan;nan,nan;nan,nan;nan,nan;nan,nan;nan,0.1;0.05,0.9;0.05,nan;nan,nan;nan,nan;nan,nan;nan,nan;nan,nan;nan,nan;nan,nan;nan,nan;nan,nan;nan,nan;nan
"Unpaid volunteer, trainee and other unpaid work ","Unpaid volunteer, trainee and other unpaid work ",0,nan;nan,nan;nan,0.1;0.05,nan;nan,nan;nan,0.025;0.0125,0.05;0.025,0.05;0.025,0.05;0.025,0.05;0.025,nan;nan,0.025;0.0125,0.05;0.025,0.05;0.025,nan;nan,0.05;0.025,0.3;0.125,0.05;0.0125,nan;nan,0.05;0.025,0.05;0.025,nan;nan,0.05;0.025,nan;nan,nan;nan,nan;nan,nan;nan
Learning ,Learning ,0.8,nan;nan,nan;nan,nan;nan,nan;nan,nan;nan,nan;nan,nan;nan,nan;nan,nan;nan,nan;nan,nan;nan,nan;nan,nan;nan,nan;nan,nan;nan,nan;nan,nan;nan,1.0;0.0,nan;nan,nan;nan,nan;nan,nan;nan,nan;nan,nan;nan,nan;nan,nan;nan,nan;nan
Socialising with family and friends,Socialising with family and friends,0.79,nan;nan,nan;nan,nan;nan,nan;nan,nan;nan,nan;nan,nan;nan,nan;nan,nan;nan,nan;nan,nan;nan,nan;nan,nan;nan,nan;nan,nan;nan,nan;nan,nan;nan,nan;nan,nan;nan,nan;nan,nan;nan,1.0;0.0,nan;nan,nan;nan,nan;nan,nan;nan,nan;nan
"Participating in social, cultural and religious activities ","Participating in social, cultural and religious activities ",0.581,nan;nan,nan;nan,nan;nan,nan;nan,nan;nan,nan;nan,nan;nan,nan;nan,nan;nan,nan;nan,nan;nan,nan;nan,nan;nan,nan;nan,nan;nan,nan;nan,nan;nan,nan;nan,nan;nan,nan;nan,0.65;0.125,0.25;0.125,0.1;nan,nan;nan,nan;nan,nan;nan,nan;nan
"Outings (Seaside, Cinema, Discotheque, etc.) ","Outings (Seaside, Cinema, Discotheque, etc.) ",0.022,nan;nan,nan;nan,nan;nan,nan;nan,nan;nan,nan;nan,nan;nan,nan;nan,nan;nan,nan;nan,nan;nan,nan;nan,nan;nan,nan;nan,nan;nan,nan;nan,nan;nan,nan;nan,nan;nan,nan;nan,nan;nan,nan;nan,1.0;0.0,nan;nan,nan;nan,nan;nan,nan;nan
Hobbies and games,Hobbies and games,0.14,nan;nan,nan;nan,nan;nan,nan;nan,nan;nan,nan;nan,nan;nan,nan;nan,nan;nan,nan;nan,nan;nan,nan;nan,nan;nan,nan;nan,nan;nan,nan;nan,nan;nan,nan;nan,nan;nan,nan;nan,nan;nan,nan;nan,1.0;0.0,nan;nan,nan;nan,nan;nan,nan;nan
Sports including keep fit activities,Sports including keep fit activities,0.17,nan;nan,nan;nan,nan;nan,nan;nan,nan;nan,nan;nan,nan;nan,nan;nan,nan;nan,nan;nan,nan;nan,nan;nan,nan;nan,nan;nan,nan;nan,nan;nan,nan;nan,nan;nan,nan;nan,1.0;0.0,nan;nan,nan;nan,nan;nan,nan;nan,nan;nan,nan;nan,nan;nan
Mass media use,"Reading newspapers, magazines, etc.",0.157,nan;nan,nan;nan,nan;nan,nan;nan,nan;nan,nan;nan,nan;nan,nan;nan,nan;nan,nan;nan,nan;nan,nan;nan,nan;nan,nan;nan,nan;nan,nan;nan,nan;nan,nan;nan,nan;nan,nan;nan,nan;nan,nan;nan,nan;nan,1.0;0.0,nan;nan,nan;nan,nan;nan
Mass media use,Watching Tv and video films,2.072,nan;nan,nan;nan,nan;nan,nan;nan,nan;nan,nan;nan,nan;nan,nan;nan,nan;nan,nan;nan,nan;nan,nan;nan,nan;nan,nan;nan,nan;nan,nan;nan,nan;nan,nan;nan,nan;nan,nan;nan,nan;nan,nan;nan,nan;nan,1.0;0.0,nan;nan,nan;nan,nan;nan
Mass media use,Listening to music,0.493,nan;nan,nan;nan,nan;nan,nan;nan,nan;nan,nan;nan,nan;nan,nan;nan,nan;nan,nan;nan,nan;nan,nan;nan,nan;nan,nan;nan,nan;nan,nan;nan,nan;nan,nan;nan,nan;nan,nan;nan,nan;nan,nan;nan,nan;nan,1.0;0.0,nan;nan,nan;nan,nan;nan
Mass media use,Social media,0.213,nan;nan,nan;nan,nan;nan,nan;nan,nan;nan,nan;nan,nan;nan,nan;nan,nan;nan,nan;nan,nan;nan,nan;nan,nan;nan,nan;nan,nan;nan,nan;nan,nan;nan,nan;nan,nan;nan,nan;nan,nan;nan,0.4;nan,0.3;nan,0.3;0.0,nan;nan,nan;nan,nan;nan
"Reflecting, resting and relaxing","Reflecting, resting and relaxing",0.51,nan;nan,nan;nan,nan;nan,nan;nan,nan;nan,nan;nan,nan;nan,nan;nan,nan;nan,nan;nan,nan;nan,nan;nan,nan;nan,nan;nan,nan;nan,nan;nan,nan;nan,nan;nan,nan;nan,nan;nan,nan;nan,nan;nan,nan;nan,1.0;0.0,nan;nan,nan;nan,nan;nan
Travel related to above non-SNA activities,Travel related to above non-SNA activities,0.298,nan;nan,nan;nan,nan;nan,nan;nan,nan;nan,nan;nan,nan;nan,nan;nan,nan;nan,nan;nan,nan;nan,nan;nan,nan;nan,nan;nan,nan;nan,1.0;0.0,nan;nan,nan;nan,nan;nan,nan;nan,nan;nan,nan;nan,nan;nan,nan;nan,nan;nan,nan;nan,nan;nan
Self-care and maintenance (including sleep) ,Self-care and maintenance (including sleep) ,11,nan;nan,nan;nan,nan;nan,nan;nan,nan;nan,nan;nan,nan;nan,nan;nan,nan;nan,nan;nan,0.775;0.05,0.1;0.05,nan;nan,nan;nan,nan;nan,nan;nan,nan;nan,nan;nan,0.125;0.05,nan;nan,nan;nan,nan;nan,nan;nan,nan;nan,nan;nan,nan;nan,nan;nan